name,review_title,review,dateAsokaGamage,Colombo Hilton 1 Night stay,"The best Staff in Any Hotel. Ever. Always made to feel welcome, cared for. From the moment I alight from Taxi to the time I departed. Everything was looked after by the excellent staff. I will always choose colombo Hilton When I visit Colombo from my country of residence",Vishavjeet S,Excellent Service,it was  a good experience to stay at Hilton Hotel in Colombo city.Although I was business trip but the service given by hotel staff gave me a feeling as if I am on vacation. The most exciting was hotel location and delicious food.,Sanjay Gupta,Looking a bit tired!,"I chose Hilton over other newer properties as it is a trusted name with an assured level of hospitality, but I found this particular one to be slightly tired looking. There is nothing wrong prima-facie, the staff is warm and friendly, the check-in is fast, rooms are spacious, linen is fresh and all amenities including wifi is provided. But then you find that the wall to wall carpet is slightly worn out; the sofa upholstery is all greasy on the edges; the springs of the mattress on the sofa side have softened quite a bit and sink lower vis a vis rest of the mattress creating an uneven and uncomfortable surface.  There should have been a shaving mirror but it seems it was removed. In these old style bathrooms the mirror is about 2 feet from where you stand and for middle aged",Date of stay: June 2016Marla A,Building works!!!!!,Would have been great but building works ruined the experience !!!!Food at Curry Leaf restaurant exceptional not to be missed.Check if renovations are still happening before you book or your going to be disappointed .,Date of stay: April 2016The_Lankan,Nice Hilton in a great location,I reserved 3 rooms in June for a wedding in the Grand Ballroom.  The service during the wedding and the stay was excellent.   I have stayed at least a few nights in this Hilton property almost every year for many years.  The staff is very friendly and accomodating the pool is nice and never crowded.   The hotel has been undergoing some construction in the lobby area for more than a year but it is very presentable and they put up walls around the area being worked on so if you did not know what it looked like before you may not even notice it was under construction because the temporary structure is so nice and looks permanent.   The hotel is located in a great spot with access to everything you need.  I took an Uber car many times and the wait time was under 10 minutes each,Joel A,"Older hotel being updated, with excellent service and staff.","Hotel is older and undergoing renovations.  Staff is extremely attentive and friendly.  Good Western food options on room service menu and on-site restaurants.  Wi-Fi is complementary for guests and works well; even for establishing VPN connections.  Located very near to the Dutch Hospital(3 - 5 minute walk); which is very tourist friendly and contains multiple restaurants and bars, along with a small ODEL store for quick souvenir shopping.  Ikoi Tei Japanese restaurant in the Dutch Hospital is owned by the Hilton, if you are a guest at the Hilton you can charge your meal to your room there, and use the WiFi for free (it should connect automatically if you are already connected at the Hilton).",TallTravels29,In need of a facelift,"I stay at the Hilton on work trips for the convenience of being next door to my office in the World Trade Center. The staff are very courteous and helpful and make sure you are comfortable. There has been renovation work in the lobby and public areas which has been in progress for over 2 years now, but the guest rooms haven't been renovated in some time. They're spacious and comfortable but the bathrooms and fittings are dated and in need of a refresh. The room service menu is very basic and needs a serious review - it's my least favourite thing about the hotel. Despite the good location and service, until the hotel is updated I feel like it doesn't justify the price which is similar to newer 5 star hotels.",Date of stay: June 2016Roe2010,,,CandyCritic,It Was OK,"We decided to stop at the Hilton in Colombo because we knew we'd be tired from a long flight into Sri Lanka.  We spent one night there and would head into the countryside the next morning.  The hotel was nice enough, not that much character, but clean and fancy enough.  As you would expect the price was on the higher end, but that's what you'd expect from a Hilton hotel.  If you were in Colombo on business or if you're doing what we were doing, you'll be more than comfortable.  The area around the hotel is OK as well.  You're close to a ""beach"", and there are a few dinning options around.  This was simply an OK hotel for the cost.  I was not blown away by anything in particular, there also seems to be a limited number of things to do as a tourist.",Date of stay: July 201566suehill2016,A great experience,"I travelled to Colombo for business in May this year and stayed at the Hilton for 3 nights. The room was spacious, attractive and very comfortable. The food was very good at both breakfast and in the evening. To unwind after the working day I enjoyed the benefits of a very nicely appointed outdoor pool and a few cold beers each night. Overall, the staff were very friendly and very helpful but I would particularly like to say a big thank you to the pool bar staff, Mahesh, Anthony and Herath who made my stay both very pleasant and most memorable. Thank you Gentlemen.",Date of stay: May 2016mbroomhead,Superior staff,"I stayed here on business for a few nights and while the hotel is a bit dated and parts are under renovation, I found it fine, and the staff were outstanding - professional and friendly. The room was spacious and wifi was very good. Buffet breakfast was fine too.  It was conveniently next door to the World Trade Center, and Dutch Hospital ( a restaurant / bar complex) pretty much over the road. There's not much else within walking distance but the hotel cars are very useful. The pool is pretty big although a bit of a walk away.",Date of stay: June 2016DubaiChampl,OLD HOTEL BUT NICE,"got a room on 12th floor partly facing the sea. the beach is around 5 minutes by walk from the hotel. rooms are spacious but the bathroom and everything else is quite old fashioned. Luckily the carpet was new. wall to wall glass door/window to view outside the hotel. For a change, the swimming pool is located otherside of the road, you need to walk through a private foot overbridge to reach the pool, that was the reason i did not see any guests swimming in this pool. Great breakfast, you get a lovely variety of food, staff are really humble and great, very helpful. the lobby bar is L shaped but still you can enjoy good drinks. Lunch buffet was also good, unable to find any fault except that renovation work is going on there and rooms and bathroom fittings, wardrobes are quite",Date of stay: June 2016Dinithi92,An international experience with a local touch,"The staff is extremely helpful, very well trained, and polite despite whether you are local or not. The rooms are very clean and neat. Lower grade rooms still have old amenities like CRT televisions! But the executive rooms (I guess) in 17th n 18th floors are a killer!",praveennimbalkar,Hotel under renovation - best to avoid,Not all recommended - extremely bad maintained hotel rooms  Bed bugs and stuffy rooms sleep less night - is what u don't want when u have a business meeting next day! Overall the worst Hilton hotel I ever stayed.,Mohamed A,Great place but little upgrading needed,I was at the hotel several times. Trusted brand and the place is really nice. I have no complain but I think some upgrading needed to the rooms. Late check-out is one of the greatest thing the hotel offered.,Date of stay: October 2015Ismail A,A perfect stay,"First of all this property is under renovation and in the reservation sites this issue was not mentioned. However hotel staff pays extreme attention to make it minimal effect on the visitors.   Hotel service is beyond regular Hilton and way above Conrad quality. They do everything to make you feel comfortable. From front desk to lobby, from doormen to room service everyone pays attention to you greet and bends backwards.   Food service is above excellent. Food quality ambience service are well above the expectations with very reasonable price.   Breakfast was perfect with plenty of selections and quality. Wait staff literally hand feeds you. Perfect hospitality.   I left $200 cash in my room with a mistake and room cleaner left it intact. Very honest people.",Date of stay: June 2016Javiz A,Great stay after a long time,"I'm happy to be back to Hilton Colombo, I have not stayed since 2012 however I'm back now end I would love to stay with Hilton Colombo when ever I come to Colombo. As some of the team members are been very kind and helpful and also they have recognized me as one of their repeat guest. Wise from concierge and room attendant Dulanjalan was great and also chef Ranjeeth, and Disa, was supper great and same time I would like to mention that the director of operations Shane, and security manager was outstanding and I can feel that they are doing their best to keep this hotel in good shape and they are also doing some renovation at the hotel.",Jane L,"Nice pool, good food","Jet lagged & desperate for a bed, this was ok for our needs. Nothing special, but typical Hilton experience. The pool area was very nice with lots of loungers, an excellent place to relax after a day sightseeing. Good views of the river from our room.",Date of stay: December 2015Sophia C,Standard,"Hilton is a bit rundown, and a lot of the facilities are under renovation so that was a pity - believe that Hilton can deliver better value once all the renovations has been completed - but perhaps they should charge a discounted fee since a lot of the facilities/ restaurants cannot be used. Staff are very friendly, attentative and helpful.",Yaser Thiab A,Hilton Colombo,"it was a nice hotel specifically the location of SPA out side the hotel building. Also, other restaurants are nicely located and traditionally decorated.   I enjoyed SPA services specially good massage done by Muddita.",alan_lok,Be careful of double charges during check out,"The counter double charged my night of stay, luckily I discover it manually, voice it out and they changed for me. I book my taxi to airport via the hotel booking, to my horror, they charged it 2 times",Sanjeev M,One of the best hotels in Colombo,"The Hilton CMB is my favourite hotel in this city. It is well located, has a great view of the Ocean and the staff and services are excellent. The quality of food and dining experiences are also very good, as are the goodies from the Cake shop.   It also has a large swimming pool. The rooms are well appointed, comfortable and spacious though now need a refreshment/ refurbishment.",Saleh A,Hilton Sustainablity,"One of the best hotels, location specially the ocean view rooms, room style and cleanness, staff are friendly and helpful, food is excellent and wide verity, and close to the beach, but the best of all since I have been to every five star hotel in Colombo, this hotel is different (staff treatment) ..",Kavi S,Excellent Accommodation,"Centrally located, close to Business District; Excellent infrastructure and very warm & courteous Staff; Always ready to help and make you feel special ! Though the Check in time is set to 3 PM, call up the hotel and request for an early checkin and they will oblige.",sharmaliej,WHAT AN AMAZING SERVICE,I had no exception of the service. But it was a pleasant surprise. Everybody went over and beyond to make our stay a dream holiday. My mother was in the hospital and the help the hotel staff provided was worth mentioning. I could not be any happier. Everybody was just fantastic.,Elisabeth E,Being Renovated,"The hotel is under renovation, which is very badly needed - rooms dated and over priced compared to other hotels in the city.   It is a business hotel.  No atmosphere if you are on a vacation or visiting Sri Lanka for the first time.",Date of stay: May 2016David L,"Best hotel in Colombo, but really old & tired",The Hilton Colombo is a very established hotel for a couple of decades.  It's still very well-maintained and is a very good hotel.  It's just old and tired.  The carpet and furniture everywhere is very dated.  The rooms are functional and comfortable.,Pmjworld,Exceptional and amazing staff,"Staff at all levels are amazing.  Best hotel experience we've had in years in over 30 plus countries. Amazing staff helpful on all fronts.   Front desk staff is exceptional, Manik is a standout   Exceptional staff attentive to all the little details.  Makes you feel as a house guest amongst family, with caring staff.  Truly an amazing experience",sunils429,Best Hotel in Colombo for business,"If you are looking at staying close to the city and best of the amenities built in the hotel then look no further just check in at Hilton Colombo. This has one of the best food, rooms and the Gym. Very close to the sea and connected to World Trade center.",Pravish14,,,Danushka85,Amazing!,I stayed for three nights at Hilton Colombo during my vacation last week( from 16th May to 19th May) and It was absolutely fantastic. I was treated like royalty and each and every staff made special effort to make my stay brilliant. Special thanks to: Arlene/ Diwya/ Kasun/ Imalka at Reception for making my stay memorable. Good Luck!,Date of stay: May 2016Carolyn R,Work in Progress,"Stayed here for 2 nights during what can only be described as a major re-fit.  Lovely staff, always smiling and so helpful. Food was ok.  Had a Margarita which was very disappointing, actually it was dreadful!  It is easy to get this wrong. BUT Had a fabulous room with wonderful views!!!!! Loved it!",Date of stay: March 2016dandreyev,Needs some work and work is being done,"This was my second stay at this hotel, I stayed there 3 years ago. To be honest, the reason I chose this hotel was because of HHonors program and having Gold status there. I was promptly upgraded to a better room, although the only difference in the room was the view (ocean vs port & city). The lobby of the hotel is under renovation and therefore some of the restaurants and shops have been misplaced since my last visit. Unfortunately, the interior of the rooms is still very dated. But it is very clean and very well cared for. The personnel of the hotel is always very helpful and welcoming. They will soon face very fierce competition from some other brands as new hotels are currently being built right in front of them and, therefore, I assume they will renovate not just the lobby",Date of stay: April 2016Sharbendu B,An excellent business hotel at a prime location,"Hilton Colombo at the Galle Face is an excellent business hotel. Off late there is some restoration work going on, still there is no impact on service etc. Most of the rooms has got stunning view of the Indian Ocean. The food is very good, in fact the curry leaf restaurant is one of the best in island cuisine.",Date of stay: April 2016premhejmadi,Wonderful Stay,"We stayed at the Hilton, Colombo from Dec 08 to Dec 10, 2015. The staff was very friendly and courteous and the facilities were extremely good and well maintained. The food was delumptious and menus well thought out. It was a memorable stay.",Date of stay: December 2015Chimai T,Can be better,Excellent staff who made up for old hotel rooms. Access to  the pool and gym are not great as they are not located within the hotel premise. The gym and pool area can be improved as they don't look like they belong to a 4-start= hotel.  Pastries are the best in this hotel.,Habib Mohammed Hadi,,,pkatya2015,Short stopover,"It's the only international standard hotel in Colombo, and it's not cheap. Breakfast is very good, we also loved the bar with the pool table. Regarding the bar, it was quite comical, actually: we arrived from the Maldives, where alcohol is banned unless it's an operating resort, and were dying for a proper drink, but it was some sort of religious holiday in Sri Lanka when alcohol is not allowed either!!! The bar was closed, but the receptionist, having seen the pain in our eyes said we could order room service. Thank God for that! Breakfast the next morning was very good, had everything you need and some local color too. We also had lunch at the outdoor cafe - not bad either.",Date of stay: December 2015Sudish S,Good property with excellent service,"Centrally located property with excellent and courteous staff. perfect business hotel. but need some maintenance for the themed restaurant and few other corners.  Also, the rooms are a bit disappointment as the bathrooms are pretty small.   Otherwise, overall its a good property and highly recommended.",Bin Alang M,Not value for money,The rate is about USD 200/night. Poor cleanliness in the room and bathroom. Slippery floor of bath room and bowl. Smelly room. The amenities in the bathroom was kind of common one. Small lobby and dimmer lights.,Haravinda,,,Meng Wai W,My stay in Hilton Colombo (First timer),"The hotel was built more than 3 decade ago and during my stay, it is under renovation (I would like to see when it finish). The staffs are friendly.  I am staying in the Executive Floor but so unfortunately the door is a bit loose (able to see the gaps) and a bit noisy when someone talks in the corridor. Overall, I am satisfy.",caravanners2,,,Loh W,Late Check Out,"The Hilton Colombo hotel is currently carry out the refurbishment works at lobby area, however it won't affect much the guest. Other than the well decoration partition you see at the lobby, you hardly aware there is a renovation works going on. I have a free late check out at 10PM at no additional cost. The beauty is, the hotel still do the housekeeping and replenish all items in the room; this is something I never expect. The staff are very friendly and the hotel internet service is superb in speed.",Vishal S,hilton colombo,"good place with good location to stay in sri lanka. taj samudra and hilton colombo are two good places to stay in colombo with excellent location.  staff is friendly, you need to know english to get your work done here",Sid_Kapur,Stay at Hilton,I stayed at the hotel for a day during a business trip. The hotel is undergoing renovation and thus the lobby was not impressive. The rooms were good though with no impact of renovations. The service was good and timely especially as I had my suit to be pressed urgently. The breakfast was good with Indian choice. The hotel is centrally located very close to cbd.,Date of stay: May 2016PaulAJ16,Under renovation,"The hotel is priced similar to other 5* hotels, but is nowhere near as nice. It's very old, and under full renovation. How can they charge the standard price when the facilities available are poor, and half the public areas are closed off? There is no way this is justified.  Surely they should either close the hotel for 6 months or reduce the price. I moved hotels after my first night (was initially told by reception no problem they'd update my booking, but by morning when I checked out said they had to charge me for the second night...I wasn't happy but also no way I was staying).  Otherwise, service was fine as you would expect at Hilton, just don't stay there until after the renovations are complete.",Date of stay: May 2016Bet2012_52,Amazing Stay,"A very memorable experience despite the short stay in this hotel. I arrived midnight and the staff were all very attentive, polite and hospitable. Room was comfortable and the window view to the sea is charming. Buffet breakfast quality was excellent and even the waiters would explain the local dishes served. Will definitely come back and spend more time in Sri Langka.",Date of stay: March 2016409rogerh,parexcellence,a great hotel and well run.Service good friendly staff.Close to all sights and attractionsHighly recommend this hotel.Restaurant and quality of food very good.Will stay there again on my next trip next year.,Viara P,Excellenet service!!!,We've just came back from a four days trip to Sri Lanka. As a part of this amazing journey I would like to highlight our stay at the Hilton Colombo. Despite of the on going hotel renovation this property is still up to high standards and well maintained. What makes the difference compared to all is the service provided! All team members without exceptions and on all levels are really awesome! Very attentive and always greeting with a smile! I would like to say Thank you All and keep up the good job!,Date of stay: April 2016rangae,Excellent!,"Everything was so good about this hotel, food was good and more over the quality was at its best... I just loved the room, I had the most amazing view ever.... There's a refurbishment going on and I'm sure it's gonna get just better!",sherifabid,Nice place to stay,"the hotel is nice , simple , and the view is great, get the executive room so you can permitted to enter the lounge and enjoy it all the day :) hotel reception people is very helpful in check in and out . food is very good and you will feel warm and  welcome",Date of stay: March 2016Adel Bitar,Untrained staff & it shows,"Since it was my first trip to Colombo, I figured to call the hotel to arrange for a hotel pick up, after several failing long distance calls, since the operator kept transferring me to reception & vise versa, Evan though I was asking to be connected with concierge. Finally, I emailed, but the reply reached me too late. I reached the airport, was received with a bunch of hustlers offering me a ride to the hotel, it was a mini bazar.  I reached the hotel, I was surprised to find out that they gave me recognition as a gold member. Went for breakfast, fruits were good, but the rest lacked taste, &  appeal They offer these butter plates to serve yourself Then I asked for a capuccino with cinnamon  First reply was we don't have it When I insisted, the same man stepped with his shoes",Date of stay: April 2016NimeshDesai,Definition of Hospitality,"Out of many 5 star hotels I have experienced, this one is the best without any doubt simply because of extra ordinary service. Ambience is excellent as expected but service is extremely delightful - Pool is opposite side of road - but  has walkway fromm hotel to go therre & is beautiful, so as other amenities - only one word to describe this hotel experience - Mesmarised. 7 star fromm my side. Excellent free WiFi makes it cherry on cake.",Date of stay: April 2016subhajeetkar,The Service in Hilton Colombo is execellent,"The staff there is really really nice and very very supporting and homely. They are undergoing renovation and are cramped for space and facilities. Yet the staff is sooo sooo good. Special mention needs to be made about the staff of Spices ( and the erstwhile Emperor's Wok some of whom who now work in the ""combined"" spices restaurant). are excellent.... they are gems . Tell you what - they spoil me with their love.",Date of stay: April 2016GB Singh,Great place to stay in Colombo,"True to the name of Hilton, Great stay, Although the lobby was under renovation but the staff left no stone un-turned to make our stay delightful. Perfect cuisine, grand halls make every occasion unforgettable.",Date of stay: March 2016JetCruiser100,,,Hanna2802,,,Petr P,"Very friendly staff, great beds, beautiful views!","OK, the hotel is old, 25+years??? BUT - it is still a Hilton and you get to know it the moment you enter the lobby, be it just a temporary wall you pass by, the doorman is there to welcome you with a warm smile on his face. The staff are very good, the rooms are spacious and clean and if you stay on higher floors, you get magnificent views of the city.   And the best news is - it is being refurbished and everybody in the hotel is very excited and proud about it because they will see the Hilton shining again new!  Very friendly staff, great beds, beautiful views! Great outdoor pool facilities, next to the spa and the gym.   And a fantastic seafood restaurant in the garden - Curry Leaf (!!) and a very good Japanese restaurant in the building across the road.",Date of stay: April 2016T6974NFnicholass,Hilton is superb,"Wonder stay at Hilton Colombo, great room and view, great service, really with everything about stay, will definately stay again when next visiting Sri Lanka. Breakfast was superb as it always is at Hilton Hotels.",Yamin,Good,Room was clean and tidy. Room boy was awesome. Breakfast was average because it had same items for the consecutive three days. Other than that hotel is doing some renovation so hopefully after that it's gonna be nice.,Nabil A,,,falconuser,Comfortable stay,"We stayed 5 nights in the HILTON Colombo, Absolutely nothing to complain about, very friendly personal, good WIFI connection and excellent restaurant ""Curry Leaf"" with a great variety of different things to eat, on my next stay I will book again Hilton Colombo and I hope that the lobby which is now under construction work will be finished",tryingtoseetheworld,Comfortable hotel!,Great hotel with good service.  Beds are really comfortable.  Wifi is fast and no limit on devices.  Good selection of restaurants on site.  Not close to the airport (the city of Colombo is quite far from the airport).  In the morning there can be a long wait for the elevator.,Date of stay: March 2016