name,review_title,review,dateHayley M,A fantastic hotel with amazing staff,This hotel has recently been refurbished.  It is a beautiful hotel with staff to match.  Nothing is too much trouble and everyone always had a welcoming smile for me!  Breakfast was one of the best I’ve enjoyed and Lilanth in food and beverage was particularly helpful during my stay.,Date of stay: March 2018ArpanD,A tired hotel - even after refurbishing,"This hotel has recently undergone refurbishing and have opened for business again. My first stay here, since the Taj was booked full. Overall, an average experience. The check-in wasn't great taking a lot of time and effort. The staff at reception somehow don't communicate prices in USD, but only in LKR, which makes it difficult for you to understand as a foreigner, how much your spends are gonna be. The rooms are pretty basic and worn out. The shower curtains were stained, but the beds were very comfortable.  Overall a decent stay, but not really upto the standards.",Date of stay: January 2018Lee-Anne Du plessis,,,Manuli Piyalka M,Best place for conference,I went there for a IT conference. They have a considerable spaces for having conference with large amount of people. Good food and friendly staff they have. It is the best place to business meetings and conferences.,Date of stay: August 2017Rashid Isa Rishi AlHeddi,,,Chanakya Jayade... J,Good place,I visited Colombo Hilton to have business meetings Its a good place The hotel that maintains Its wash rooms best Among the staff Peshila served me well at the lobby  The newly renovated ambience is also adding to the hotel,Date of stay: March 2017Vishal P,Good Hospitality with close vicinity to Galle seaface,"This is hotel with overall big area to spend time with your family,the pool is on the other side of the road well connected by a inner bridge,clean rooms with good overall service,the spread is also wide which we normally find in other Hilton hotels,its a old property(u cant compare it with newly built hotel) but still well maintained",Date of stay: January 2018I4883UHmohamedi,Short Business Trip,"Great location and close to shopping and street market area. Good view of port area. Overall, great experience for a business trip. Located close to World Trade Centre and accessible from the hotel. Good buffet.",Date of stay: December 2017Manu,Nice business hotel,"I was there in Colombo for a short business trip, stayed in this hotel as it is just next to WTC. This hotel has very good access to WTC and if you have work in WTC, this is the right choice to make if you do not want to take a cab or riksha.  Rooms are nice and clean. Staff are very friendly and cooperative. I faced few issues during the check-in at the hotel as the staff were not able to figure what to do for early check-in. Other than that, it was a nice comfortable stay. Food is great and it has variety of options.",Date of stay: December 2017livans74,Short business trip,"Great location, great F&B, overall great experience for a two days business trip. The rooms need renovation but the sizes and overall offerings are great. The staff is quite friendly too. The Wi/Fi is up and down. Might need to be upgraded.",StephenHolland,Great hotel  in the old Port quarter,"Close to port area and street markets, the Dutch Hospital area and the seafront. Magnificent food buffets and attentive staff. Pool is across a footbridge and is a little dated but otherwise good. Held a birthday there in the ballroom. Recommended.",Date of stay: January 2018Biz T,Surprisingly average experience,"Disappointed with checkin service as it too a long time and the staff didn't seem happy with doing their job. Room felt slightly dirty, especially the carpet. Buffet restaurant was truly superb for breakfast, lunch and dinner. This was the best part of my stay.",Atul2111,Good hotel which needs to improve on service aspects,"Very good property with excellent location. Food is extremely good with variety of local and international cuisine. Breakfast restaurant staff is also very welcoming and friendly. But front office staff, pool side restaurant staff and room service staff - experience not so good.",Caren99,Perfect Family Stay,"We chose to stay at The Hilton, Colombo as we had a 40th Birthday there one night and NYE the next night.  Travelling with 2 kids aged 10 & 8.  Booked a corner suite which was a large king bedroom and a large sitting room where the kids had two roll-out beds.  It was the perfect space for us.  TV's in both rooms, smaller but good bathroom (a little dated now).  Overall the room was great!   Items of note:  the bed was very comfortable, the service was outstanding,  there is a great cafe inside the hotel in the lobby which has very delicious snacks and kept the kids happy.  The pool is actually across the road and you access this by crossing an over-road bridge.  The function we attended for the 40th was outstanding.  New Year's Eve by the pool was very overcrowded with tables",Date of stay: December 2017anne p,HiltonColombo,The hotel foyer and entrance area was recently renovated and it looks fantastic as does the Graze restaurant.  However our room on the 11th floor looked old and tired.  The bathroom was in desperate need of a makeover,John H,,,Kate H,Efficient but ready for a serious refurb,"The Hilton is in the middle of the business district. The staff are charming polite and nice, the food is also good and the best breakfast buffet!  However the standard of the rooms is very old school - old fashion not charming old school. Bathrooms and toiletries not up to scratch and beds not new. Even the lifts are from the 70’s.",Date of stay: January 2018CDSNJUS,Good Location,"Location is great, lobby appearance is good but the rooms have old furnishings. Maybe some renovation under progress. Staff is very helpful, goes out of way to help you. The electric switches and plugs etc in room are very old.",Paulo C,Hidden costs,"Booked through Booking.com and was surprised with 30+% on taxes on top of the stated price. Otherwise, great location, good food, helpfull staff and functional social areas, but rooms badly in need of being renovated",Date of stay: January 2018rajeshras,Amazing,"Well established hotel , super quality n excellent staff members (Specially Mr. Omesh, Dilen) . Good food, well cleaned , good location, parking, nice lobby area, And we had a memorable time there (31st eve) alllll gooooooooood.",Marc K,"Prestige, but with a twist!","We arrived at the Hilton in Colombo at around 19:00, this with no intention the spent the night as we had a flight later that night.  As backpackers are accustomed, wearing shorts and flip flops we boldly asked if we could store our backpacks for several hours!  We were sent to the concierge and the first answer was NO, because we are not guests of the hotel. after some ""begging"" he finally aloud us to store our luggage.  When we collected our luggage, we even had the time to change our cloths at the bathroom and the concierge arranged at taxi to the airport (3500 LKR), it's about an hours drive.  And the provided us with a bottle of water each.   Many thanks to the Hilton and it's impeccable staff! For this kind of service I will take my hat of!!!",Date of stay: December 2017Harindu Gurusinghe,Easily accessible location,"The location which the hotel is located is easily accessible. We attended a wedding function in the hotel, as no space was left to park the car had to park it bit far and walk to the hotel. Better if the parking area can be increased. Only a few choices are left for the vegetarians in the buffet.",Date of stay: December 2017Suren S,"Outstanding service, staff are really on the ball to assist. We had an excellent time here. Room upgrade, late checkout",Etc.. memorable Sri Lanka. Staff at all tiers were flawless in service delivery. This hotel lives up to the Hilton brand. The foyer and meal sections were brilliant. The breakfast was second to none with such great variety. Entertaintment over the festive period was amazing. Rooms need upgrading.,colombo634,Excellent stay...,Used hotel and status to start and end trip.  A great place to treat yourself before the long trip home.  Staff is great and plenty of choices within hotel to eat.  Would stay again here for sure if another trip to this destination occurred.,doshis,,,Yash V,Nice business hotel,"Nice business hotel adjacent to World trade center , served my purpose as my office was in WTC. This one is a slightly away from core attractions and Colombo town, but if you are going to spend most of your time in Colombo Fort Area .. its a great option.",Date of stay: December 2017tarikbangkok,Hotel Quality Standards,"This hotel needs to be more consistent in its quality delivery - staff are nice albeit the F&B staff particularly at breakfast quite robotic. You can have a good 3 star + experience at this Hilton - the hotel is dated and in need of upgrading. Coffee service is different in every part of the hotel, rooms old and low tech, swimming pool dangerous levels of chlorine ( i swim a lot this pool I had to get out due to much chlorine) - old and dated towels, poorly maintained pool area.",shirleyt302,Feel like home,Colombo Hilton is like a home outside your home country.  The hotel is within the city and is easy to commute using either the hotel taxi or the three wheeler.  There are lots of eateries and shops within the walking distance especially the jewellery shops at the World Trade Centre which is just next to the Hilton.,salman_gharagozloo,Poor rooms with luxury lobby,I ve stayed at this hotel for 2 nights.the location is good.u can reach the galle face beach by walk. The lobby is giant and decorate for christmas in best way.but the rooms has nothing.just a simple room with small bath and old decoration.i ve stayed at 9 floor. The breakfast is ok. The swimming pool is too far from lobby and u should pass a bridge to access swimming pool !the staff are kind and helpfull,Date of stay: December 2017Thishanie D,Christmas Evening..,The place had good vibes on the eve before the Christmas and we had some good time listening to the Christmas carols being sung by a group of young ladies.. Enjoyed some evening tea and snacks while there and loved it..,Date of stay: December 2017Nishantha P,5 star hotel which closes at 11,I don’t understand why a 5 star hotel does not have a 24 hour coffee shop. We called the hotel at 11Pm and was surprised that the person on the phone confidently said that it closes at 11.30Pm. Honestly a big joke!!!! (I’m even talking about a Saturday),Date of stay: December 2017siva1945,Hi Tea at Hilton Hotel,"We were taken to this place by some relatives; There was a variety of food - ranging from Western to Asian; Sri Lankan foods were very tasty, some with spices and others without.  We were able to start soft, with some fruit juices, then with entree, and then with the main meal. There were many deserts too, to satisfy the whole family.",Date of stay: November 2017anushkka,,,mf2006,"very good stay, very good impression","It is a very good hotel, especially if you travel for business purposes. The rooms are spacious, clean and comfortable. All the proper amenities were there, as well coffee/tea in room available. It is very nice that water bottles are offered in the room and renewed every day. Beds, linen and towels all of good quality. The personel is very kind and helpful. Breakfast with many many choises for every taste! multinational indeed. The food in the restaurants also intresting. Very fast wifi.",Date of stay: December 2017ApurvNagpal,"Amazing property, location and staff","This has to be amongst my favourite hotels in the world. Have stayed several times but this last trip was truly exceptional. I love the renovations being done - adding a touch of modernity to the property. The breakfast spread remains amongst the most sumptuous we've had. And the service was truly exceptional - since it was an anniversary trip, the staff, especially Jessica and Kushani, went all out - we had a cake, a lovely stuffed toy (with special significance) - and several other ways where they helped make our stay memorable. The executive lounge is great - loved the atmosphere, the staff and the nibbles / drinks they serve. And the location makes it great if you enjoy walking on the sea face / you're just a stone's throw from The Old Dutch Hospital & WTC. The room was very",Date of stay: December 2017EmmKu,Old property in need of urgent upgrade,"Service at Hilton Colombo is generally very good and the lobby is lovely with live music in the evenings, excellent patisserie and food as well as drinks. We tried the patisserie as well as Graze Kitchen which were both great, offering a variety of local and international treats.  The hotel rooms have great views from the upper floors (we stayed on top 19th floor with waterside views), but the building is very old and dirty because of old age and wear and tear. The rooms always therefore feel a bit dirty and the bathrooms are not comfortable because everything looks like it's been used by thousands of people before you. Shame for the Hilton brand.  The fitness centre where the equipment is located is great - machines mostly brand new and therefore very clean.  I also visited the",Date of stay: December 2017SMW-Globetrotter,Good Hilton Hotel with all the things one would expect,"Centrally located hotel. Good rooms and ambience. Very courteous staff. Good facilities like bars and restaurants.  We stayed on our home as conveniant and becasue of Gold Member benefits. Great for business travellers as well as for a family holiday and up to the Normal Hilton standard.  For us the music was to much during dinner, but food was to a good stadard all the same.",Date of stay: November 2017rajapaksemudiyseln,Enjoyed the stay,"Enjoyed the stay at Hilton amidst of a busy schedule. The staff were extremely helpfull and courteous. Getting around places was easy, whilst live music kept the guest happy. Addition of few more boutiques will be an added value.",DanaGherasim,Such a wonderful hotel,"We have stayed at Hilton Colombo at the beginning of our trip in Sri Lanka. The hotel has great views over the city, from the top floors.   Even though the hotel is not new, the lobby is fully refurbushed and it lookes great. The room is confortable and well equiped. The breakfast, oh, the breakfast is amazing. Srilankan food accompanied by international dished. Well, one could not expect less from a Hilton hotel.  We also tried the pool, which is quite big and has a nice bar and an italian restaurant.  A 10* to this amazing hotel! Thanks to all the staff who made our journey in Colombo so nice and cozy ❤️",Date of stay: December 2017francis v,Amazing lunch,"The new restaurant at the Hilton Colombo, was exceptional, we had friends visit Sri Lanka for the first time and we took them to the Buffet Lunch. What a delight, the presentation and variety of the food was exceptional along with the very pleasant staff. Well done Hilton!",Date of stay: November 2017anandramaraoy,Great location and good property,"The location is central and easy to access the business areas. It is also close to the sea and the promenade. The rooms need an upgrade and refurbishment. The carpets should be removed from most areas, as this is a humid tropical location.",Solomon W,Smoking Room assigned to Non-Smokers!,"I am a Hilton Honors member but EXTREMELY DISAPPOINTED that we were placed in a smoking room when my wife & I both highly allergic to cigarettes & nicotine.  Right now her throat is swollen and she is having coughing & breathing problems.  I pleaded with them to give me a non-smoking room but because they were having other ""Conferences, they were sold out"".  Sold out on your part, does NOT mean that we are to suffer on our part.  I would have canceled and stayed in another hotel but my group and friends had 7 other rooms at the Hilton, Colombo.    Because of this nightmarish experience, from now on I, my company, my family and ALL my friends are going to switch to Marriott or Hyatt.  I am sorry to do this because I have really enjoyed my LONG association with Hilton.  So goodbye",Sandeep K,Good Hotel,Centrally located hotel. Good rooms and ambience. Very courteous staff. Good facilities like bars and restaurants. SPA not very good. Great for business travellers as well as for a family holiday. Also has a nightclub in the basement.,Date of stay: January 2017travler-ceylon,Grace Kitchen,"Everything was just fine - I always I like this hotel for their standard , service , food ext  Valet service is horrible - we had dinner in 2 hrs and waited at the main door exactly one hr for the car . No body to manage trafic at the main entrance -  What is wrong ?",Date of stay: December 2017I9968WVjasonp,Nice property,Lobby/main floor is spectacular - very impressive.  Modern & chic.  Rooms are not as updated but more than satisfactory.  Minibar in room & free water bottles all the time.  Very pleasant & attentive staff.,Maduwantha P,Unprofessional staff,I went there to pick up someone and couldn't find place to park the car (very limited car park space) and had to go for several rounds and when managed to find a place to park one of the doorman by the name MANJULLA came shouting in a very unprofessional manner. I guess parking is only available for luxury cars. I complained about this to the management and seems no action was taken. I have visited Hilton many number of staff their service level has dropped drastically. Highly disappointed,Date of stay: December 2017Allimurray,Lovely hotel,"This was a great hotel to stop over in Colombo before we travelled on. The staff were fantastic and the service great. A couple of things to know, some of the food is buffet and although lovely sometimes needs to be hotter.  The stir fry food is great and cooked fresh as it the fish in the curry house and would recommend it.  The pool is fab but there is a 5 min walk required to get there, and it can be sometimes noisy, but we had a lovely swim The rooms are clean and of a good size   All in all a love,y start to our holidays",Date of stay: December 2017Imran A,Black Tie Dinner,Was with colleagues to this Wonderful event where you meet all your present and past networks. Could have been better if the intervals between the courses to be more efficient. Still enjoyed the food and it's quality.,Date of stay: November 2017kengkeelim,GOOD HOTEL,"Our trip was to part business and part leisure.  The location near to the Ministry of Crabs in the Dutch Hospital is good.  Our driver was able to access the hotel easily. However, the hotel is old albeit the maintenance is good for the age.",niyomk2017,Good location for both business and life,I found it was very easy to find halal food courts and masjids for business muslim guys who are seeking a great venue to have both business and life.  I was very happy that I can visit many places after my business time.  The hotel staffs are friendly. I can ask for any assistance for multi-purposes to make my goals here done.,Praveen R,“Back Again”,Good enough to stay on a vacation. Very attentive yet discrete staffs. Magnificent views over the city. The suits are spacious and comfortable. The pool and the others amenities are also nice. Highly recommended....,Date of stay: November 2017teejgonzales,Great Stay!,It was my first time to be on Colombo on a business trip and my stay here went every well. The lobby was newly refurbished and the staff were very accommodating. The breakfast was really delicious and had many options. Internet speed just needs to be improved.,manunandhans,Bad experience at Hilton Colombo!,"First time ever I experienced very bad service at Hilton Colombo , to be specific while the reception staff were good both restaurant and cab services desk people were very bad. Better avoid if possible using these services",MrJerry_UK,Excellent service,"My wife and I stayed one night and were suitable impressed with the initial customer service on arrival at reception, the overall ambiance and variety of food available in the restaurant. Totally recommend this location and hotel.",Date of stay: November 2017A Abiman,Good hotel good location,"Very nice hotel, great staff, normally i travel for my business purpose and stay there at 5-7 days I have Hilton honour members get free wifi but speed is not enough like 2-3 Mbps download 1-2 upload speed. Finally  I have to end up buying Dialog data sim and place it another phone making my own wifi hot spot this Dialog Sim give 20Mbps upload and 5Mbps download speed., sim and data is 1500 rupees (US$9)  for 5GB usage day and 50gb for 30days, So Hilton please increase your wifi speed you will get more business customers.",Date of stay: April 2017LILABBY1,Nice hotel in the city!,"It was my first trip to Colombo and I was very happy with the hotel. The Hilton driver picked us up from the airport in the middle of the night and it was an easy commute, in a nice vehicle! They even gave us a nice, refreshing drink upon our arrival, despite the time.  The lobby is beautifully renovated, but the rooms definitely need some updating. The food in the executive lounge was excellent for breakfast, but my husband and I were even more impressed with the happy hour. The food was excellent and we even skipped dinner at the other restaurants because it was so filling. We loved the chicken dumplings and the drink variety was excellent, with a choice of beer, wine or liquor. I also really enjoyed the pool, but I think the service could be stepped up. The pool waiter didn’t",Date of stay: November 2017411minhajk,Worst Hilton Experience,There was an awful smell in the room with a card addressing someone else. It seemed I was given a room that was turned down by another person. Request to change the room denied and room freshener sprayed.  Worst ever experience at Hilton.,HLA3,,,Abhishek A,Poor service in Hilton - Deterioration in service - Hilton Gold Member,"I think Hotel service has deteriorated over last two months. I am Hilton Gold Member (158099491) and stay here often. However service has deteriorated over last two months. During current visit - I didn't have water in the room, Taps were not working properly. Hotel has gone down drastically in its service and rooms require serious maintenance.",Date of stay: November 2017shubhamjaiswal,looks expensive but it isn't,"one of the top hotels of Colombo great chain of hotels, located in city center for local exploration  luxury but affordable hotel in Colombo strong recommendation to stay as value for money awesome interior and artworks",Date of stay: September 2017Ben J,,,senuri z,Excellent place,"Hilton Colombo is the best place to spend a vacation. Rooms are really attractive, comfortable and clean. Great service from staff. Close to good beach. Very nice host! and good location too..We will definitely staying in Hilton Colombo.",Date of stay: December 2016Maddy,One of the best in Colombo,"If you are looking to go for a romantic dinner or a family dinner, this is the best place in my opinion. Not only the staff is very helpful and friendly, ambience is great and the food is awesome! In addition, I have organized several events there and it was totally hassle-free and the staff was very helpful.",Date of stay: August 2017lalindrade,,,annprivett,Holiday,"We stayed at the Hilton on our arrival in Colombo and returned after our holiday in Srilanka for 1 night before we flew out. The food was great both breakfast and dinner. Service great in fact the friendliest hotel we stayed in . The rooms are looking a bit dated. I’d love to pool to be closer but once you get to the pool it is fantastic, worth the walk across the road . The pool staff are excellent, I’d definitely stay again",Date of stay: November 2017224cpr,"Except for some mold-growth around the bath tub and a ring-around the toilet, all was well.","Mold growth around bathtub and toilet ring. Overall, staff was very friendly. Food was satisfactory. Ambience was good. Proximity to the beach was a positive thing. Colombo is a good, clean city. Good town for a holiday",WonderingTroubadour,Freaking Fantastic,"I decided to go to Colombo for the weekend, and I wanted to try a Hilton hotel (in a different location). I am used to Hilton hotels in Abu Dhabi. Hilton Colombo is fantastic! Much better than Hilton Abu Dhabi. Price, location, service, presentation, rooms, pool ..... all great, all amazing. The breakfast buffet was exceptional with food from different regions. I highly recommend this hotel.",Wei-Heng C,"Great service, unbeatable location","Our first trip to Sri Lanka. What a great place to start our trip. It is located at the Fort, near to all the key attractions around the port. The staff are just awesome, great service. Rooms are a bit old, but well maintained. My favourite: the breakfast spread. If you like Ceylonese and Indian food, this is it. Great way to start the day.",Date of stay: October 2017WorldExplorer212,,,selenamedawala,,,aizanasmaon,Sri Lankan Hospitality at its best.,Service service service. They are one of the best n most wonderful service staffs I've ever known. Kudos to the management. Something must hv gone really right on yr training manual. You guy did well hosting guests. Food was amazing too. Special mention to Vajira. We ran into some small issue there. She took charge n solve the matters within minutes. I stayed in room 1515 on 24th to 27th September. I'm dying to return to Hilton Colombo agn.,Date of stay: September 2017