user,review_title,review,dateerau556737,Ver good value for money,If you seek somewhere cheap yet comfortable to stay in Colombo. This is the way to go. Staff are super friendly and the facilities new and clean. Location wise its also ideal as it it is close to the train station which most travellers will come and depart from. Thumbs up. Cheers,remmol517843,Good for short stay,"If you want to find a good and easy place in Colombo where stay for a couple of days, Star Anise it's a good choice. The capsule are comfortable, clean and keep a good level of privacy. Forniture and all over building is new.",Billiek80,Nice new accommodation,"Nice hostel, looks very new as everything was clean and fresh.  good location, really friendly and helpful staff. Close enough to all the sites. Got ripped off by tuk tuk, so just be careful with that.",Antonio V,First time in a capsule!!,"Clean, young, international, cool... What an amazing experience at Sun anise boutique capsules! Can't wait to find other capsules all around the world!  Best quality hostel at a very competitive price!! Antonio",Date of stay: August 2018eemilar3,Great stay!,"Me and my girlfriend stayed at star anise for two nights and liked it a lot. Nice staff, great location and clean spaces. My luggage was delayed for three days and the staff was very helpful throughout the “process”.",Kug,Safe and secured,Wow. This place is amazing. They are very professionally and organised. I like the atmosphere of the hotel and people here. The fromtdesk staff were professional and fast at their work. They made check- in easy. Keep up thr good work as I will be back in november. 😁,Date of stay: June 2018Von J,Terrible Experience,"Booked an ensuite private room. On arrival we were immediately told they don't exist. Hostel failed to inform us of this and blamed Hostelworld for their incorrect advertisement.  As it was 12pm we were forced to stay for the night. The hostel illegally charged us more than was written on our receipt. The receipt was also completely fraudulent. It had my name, even though it was my friend's card and a completely made up card number. HostelWorld have been fantastic dealing with my complaint but the hostel won't even respond to them. A terrible experience that I hope no one else has.",Date of stay: July 2018liam s,"Clean & conveniently located, friendly staff","We stayed in Star Anise Boutiques capsules twice at the start and end of our travels in Sri Lanka. We booked a double bed capsule, paid c. €24 Euro in total per night stay. On our second visit, as we'd taken an early morning train from Kandy to Colombo, we arrived very early. We availed of early check in (cost c. €9 extra)  We stayed in the 'Doublebed capsule' dorm room. There are also singlebed capsule dorms.   Accommodation location is decent: less than 10mins walk to Colombo Fort Train station. About 40 - 50ish min drive to airport (traffic depending).  Plenty of local convenience shops, cafes, restaurants all within walking distance.   The bunks themselves are pretty big. Each bed comes with its own small locker. You won't be able to securely store big backpacks, but plenty",Date of stay: July 2018Megintheworld,Friendly and professional staff,"I really enjoyed staying there becaue of the staffs are amazing!! From check-in to check-out, they are very friendly and professional. I would recommend anyone who’s budget traveler but also care about cleanliness and privacy. It was the first time I stayed in a capsule hotel, and I usually don’t stay shared room because I care about my privacy and don’t like shared bathroom, but Star Anise changed my image of shared room experience. Bed, bathrooms and common area were always kept clean and there’s a curtain which you can have more privacy. Highly recommend!!",ahilto258206,Star Anise,"I've been backpacking for the last 2 years and have stayed in many hostels. My main criteria are; comfortable bed, an ability to make the space private with curtains or blinds, own reading light, international sockets, social space. Star Anise has all of this",DawidSchalk,Great stay,The hostel is close to the hustle and bustle - conveniently located near the station. The staff was friendly and helpful. This is a great stay for the budget traveller. We had a good time and would happily return on our next trip.,Haafidh F,"Four Stays So Far, Plenty More Ahead!","I first booked this hotel last year in November, never tried a hostel before that. Thought it would be a bad idea but it was amazing due to the unique concept and the best part I have noticed of the place is the lovely staff. Fast forward to this year July, I booked again for my multiple stays in Colombo while travelling in Sri Lanka. The staff are as friendly as ever. The place looks as new as last November. The hotel is great for short stop over and for long stay as well. You can meet a lot of fellow travellers and hear about their trips for inspiration. One thing though, it would be great to bring back the cups of noodles for purchase as stores close rather early in Sri Lanka. Nonetheless, definitely coming back!",Date of stay: July 2018ccloss588530,Beautiful Hostel with super friendly staff!,"The location is top, because you have all the connections from the close by train station, bus station to the city buses that go downtown. 2 minutes walk to the Dutch hospital which is amazing at night with restaurants, bars, live music and dancing events. The staff is super friendly!",Laetitiahx,"Very clean, well situated !","We stayed there one night before taking our flight back to France. We arrived during the night, because we were in a night train from Trincomalee and there was someone at the reception. It is just 10mn walk from the train station. The room was very clean, the capsule was comfortable. The breakfast was nice (tea or coffee, papaya juice and fish sandwiches). This hotel doesn't provide shampoo or soap but they have towels.",Date of stay: July 2018tashacorrodus,Excellent quality service,Smart and clean accomodation. Stayed for two nights in total on my first and last night. Quiet and relaxing. Excellent customer service. Dimitri on reception was very helpful and went out of his way to make my stay in at the Star Anise a great one! I would highly recommend this hotel for short trips/or in transit to other parts of Sri Lanka.,pingupng2004,Definitely a good stay!,"We stayed for one night as a transit. At first we quite worry that our room will be too pack or not secure. But ended up the room and the bed are both very good. For bathroom wise, it’s located in the room but the water pump and heater are not stable. Overall a good stay!",Yasmine Yau,,,Bryan Tan,Great for a night’s stay or two!,"The hotel was situated near the main city. It was walking distance to most tourist attractions. The wifi was slightly patchy but still alright. Staff was very helpful, and capsules were clean. Toilets as well. Breakfast was simple and yummy.",Date of stay: July 2018anitapratt92,"Great location, average service","We had a similar experience to those reported by other guests.  Location is great however cleanliness could be improved (sheets stained, bathrooms untidy, & no toilet paper in some cubicles).  Note - bathroom and shower facilities are unisex.   After checking out and waiting for our car to the airport we were told we were unable to use the common areas (which were empty) and needed to wait in the lobby (nb. luggage is stored on the floor of the lobby).   Overall - okay for one night stay, however there were a few loose ends.",Date of stay: July 2018LucieTraveller3,Amazing stay,"My stay in Star Anise Boutique was really great. People working there are so nice. They helped me and supported me as I spent a really bad day. Everything was so clean and nice, bed was comfortable (one of the most comfortable bed during my stay in Sri Lanka). And it´s totally safe for solo female traveller. I can highly reccomend!!",tvda88,Great place to stay and meet people,Star Anise is well located in fort next to Dutch Hospital and the Fort railway station. The staff is always very helpful and friendly. I would highly recommend this place to anyone looking for a base while travelling in Sri Lanka.,Gaia W,Perfect,"We stayed here on our first night in Sri Lanka and it was the perfect choice. Great location close to the train station and markets. The staff were very friendly and helpful and the 24hr check in helps a lot with any late arriving flights. The room and bathroom were all perfectly clean and the air conditioning made it a nice escape from the heat outside and a very comfortable sleep. The capsules feel very private with plenty of space inside; there is also a large lockable storage under the beds.  Breakfast, tea and coffee was nice, and the upstairs deck is a nice little escape with some plants and greenery. We will definitely stop back here on our way out of Sri Lanka, and highly recommend it to single or couple travelers. Thank you for the stay 🙂",Date of stay: June 2018cchang940951,worth it,"staff are helpful and kind, bed and shower room are clean, good location, very near the railway station and bus station. had  best ever breakfast at this hostel, amazing and superb! everywhere are very clean, this is my first time into shower room without slippers.",thecolordiet,"Nice, quiet accommodation near the Dutch Hospital Shopping Precinct","It was my last night in Sri Lanka after touring Ella, Kandy and the likes, and I just needed to stay one more night before catching my morning flight out of Colombo International Airport.  I ended up making my decision based on location - this was a 15-20 minute walk to the Pettah Bus Stand (where I would be taking the airport bus) and also a 5 minute walk away from the Ministry of Crab, a restaurant my colleagues have highly recommended.  Safety in the area was also impeccable, with some important buildings around - i.e. police everywhere.    The hotel itself was nice, and definitely looks very new.  A plus for me was that the AC is fairly strong (a nice change from my lack of AC the rest of the trip) and things were in general very clean.  Staff was also nice and helpful in",Date of stay: May 2018Florent C,Comfy but lacking atmosphere,"Good place to stay for a night. Comfy, clean and practical. Walking distance to the Railway Station. Close to a couple of restaurants. But lacking the atmosphere of a true hostel. More of a place to crash than anything else.  Also a bit pricey compared to other places I’ve stayed at, and the breakfast is only OK (sandwich, juice and coffee) at that price.",njames464577,Loved it!,"Brilliant place with great staff. It was so clean & we had 4 toilets/showers just for our dorm!  Nice location, close to the train station. We would highly recommend to stay at this hostel!   Thanks to Vincent who looked after us & even booked our airport transfer!",vimcrc,Star anise,Very nice place to stay. Its reasonable price.Staffs are so friendly and helpful. Rooms and bathroom are clean. Convenient for shopping or go around colombo city. Very easy to get tuk tuk or taxi. Breakfast was awesome!!,Simonest,"Clean, comfortable and centrally located","It’s a beautiful place. Very clean and staff is polite. Air conditioner works 24 hours and the rooms are immaculate clean. Just the curtains can be a bit noise when people are getting out from their capsules without opening it properly. We got a double bed capsule and it was good. Although staff are also using those toilets.  Very disappointing  breakfast. We didn’t get the one in the menu and it was still 8:15 am (they serve from 7 to 9 am). So they offered us a sandwich with sardine, mayonnaise and onions plus tomato. It was not definitely tasty and I couldn’t eat it as the flavor of the sardine was not good. So I asked for only toast and butter. Also very tasteless. Luckily I had cake in my backpack so I was able to get my own breakfast.",Date of stay: April 2018Alexa M,Snuggly,Started Anise was a very clean and comfortable place. The staff were exceptionally friendly and helpful. The beds were amazingly comfortable and loads is space. Quiet small amount of beds which wad nice. Had options for double beds if your a couple. All mod cons. I would happily stay there again.,Date of stay: April 2018Dewet V,Mr,I am in vacation in Sri Lanka and was staying at star anise while in Colombo. So because of this naturally I had the habit of sleeping slightly later than usual. When I went to have breakfast at 9:11 I went to sit down and with put greeting or even standing and coming too my table the manager shouted across the room to me breakfast is over. Then when I told him it 11 minutes past 9 he got up and straight away changed his posture and attitude to be ready to be aggressive. If you can not even compromise 11 minutes on a breakfast which someone paid for you should not be a person in hospitality. And this is the manager of the establishment. Once again I see a employee tarnish the name of a establishment on such a small simple matter. Will not return to this place.,Date of stay: April 2018James W,Bargain Hotel or Fancy Hostel,"Bridging the gap between hotel and hostel, the Star Anise is very clean and surprisingly quiet, yet has the common areas you want for meeting fellow travelers. The desk is open 24/7 so don't worry if you come in on a late flight.  In a great location and the price is a bargain for Colombo.",AqeelMaqbool,Its a Hostel,"In all fairness, i didnt stayed in the place but did visit them (so take my review as is). Reason being, while i was researching place to stay in Colombo, the way this property describes itself is confusing. They say ""privates"" on a booking.com (or some other site i visited). But the pictures looked like bunkbeds. So i visited them to get clarity and it was indeed bunk bed. Maybe its just me but putting a curtain on bunk bed does not make it a private. Almost all the places i have stayed in past only advertise ""private"" when they are selling you a room and not just a bed in dorm. Price for a bed in 20 bed dorm was a bit steep for my liking but i would still have stayed had i got lower bed available since i was already at the property. They also ask you to take off your shoes at",Date of stay: March 2018Philipp W,Nice Hostel for One Night in Colombo,"The hostel is very central in Colombo Fort, only a short 10 minute walk from the bus station with heavy backpacks. Capsules are very clean and with the shades provide enough darkness. However the noise depends on the other guests in the capsules room (normal for hostels though). We need to point out Vincent, the owner, who went out of his way to help us get information for our next trip. Breakfast was good as well.  Overall for an overnight stay definitely recommendable!",Date of stay: March 2018Yuliana H,,,Mark B,Great value stay,"Had not stayed in a capsule hotel before, opted for the air conditioned deluxe capsules. Very comfy bed with plenty of storage space. Good wifi and air conditioning was extremely useful. Location is pretty convenient for Pettah Market and Fort Train station, but is a bit of a distance from the parts of Galle Road that tourists frequent and the Museum/park. Had transport organised from airport for 20USD.",Date of stay: January 2018Ian C,"10/10 Hostel, returning (twice!) customer, super clean and friendly staff","Location is absolutely wonderful! in the fort area, closed to the colombo fort railway station and pettah bus stand. The hostel is simply behind the Dutch Hospital area, sufficient food options in this area. In terms of the facilities and rooms, super clean and tidy beds, i love this place, feel comfortable with its wooden design and clean floor. Washroom is great and clean. Breakfast is actually light, but somehow it's enough for me. Vegetarian option is not a problem here. I had a very good time here, meeting some new friends at the hostel and feel relaxed and enjoyable.",Date of stay: February 2018averro_670657,Very good value for money,"Bedding is very comfortable, safe place, staff is super warm and helpful. The hotel is very well located in the city. The only low point is the absence of a real shower, but the comfy bed makes up for it.",Oana P,Good experience,"The Hostel has an excellent location. The bed was clean and staff was friendly. Breakfast was good, Sandwich and fresh fruit juice, coffee and tea. Storage under the bed for the luggage with 2 compartments. The strange thing was that you had to walk around barefooted 😅. But I had good rest after one full day of walking around busy Colombo.",Date of stay: February 2018BrookeJavier,Perfect! Highly recommended!,"Friendly staff, great location (walking distance around the fort and about a 10 minute walk from Fort train station), great facilities and comfy beds! We were alittle hesitant booking this as we had never stayed in the capsule style before but we have been completed converted. Staff went over and above with help! Highly recommended!! And we will be staying there again :)",Date of stay: February 2018James T,Beds with blinds doth not a capsule hotel make,"So the pros - the location is excellent, and the staff are very approachable and friendly.  I'm afraid though, that the main thing we came away with was a sense that we had not stayed in a capsule hotel, but rather in an expensive hostel dorm with roller blinds over the beds. These blinds offer a degree of visual privacy, but don't mask any sounds. We therefore heard every syllable of our delightful German dorm mates post pub conversation when they returned home. Danke schön.  There is also no proper storage space (in a normal hostel there is at least usually this). For the price I would expect some.   The staff seem to be in the habit of replying to Trip Advisor posts, so to rebut that I'd say they the Star Anise deserves some of the bad reviews its has been getting purely",Date of stay: January 2018Ivo D,Impressive!,"We were fascinated by Star Anise by the moment we saw the entrance where you leave your shoes and you walk up the stairs! The staff is welcoming and helpful, the place is immaculately clean and during your stay you will see some guys regularly cleaning all areas. A/C allover is saving you from the Colombo heat. Bed mattress in the capsule was comfy, lighting in the capsule is really good and you have the powersockets with USB ports for direct charging. Enough bathrooms and toilets, so even though the place was booked out we never had to wait for the facilities. The place itself is decorated artistically and creates a homely feeling. Breakfast included porridge and a lot of fresh fruits, tea, coffee. Overall - we had great stay and experience at Star Anise. We would definitely",unsubscribe_diatribe,"Great place, ethical question","Mkre privacy and silence than a hostel but with budget prices. Clean as could be, owner shared a taxi with me to the airport saving me a tonne of cash, amazing staff who went far beyond to make my stay comfortable. Highly recommend.",Brisliam,Essentially an expensive hostel,"The place is essentially just a hostel, and an expensive one at that. The capsules are too hot even with airconditioning on. They wanted $10USD for baggage storage. Opted against that and stored for less than $1.50USD at train station.  On the plus side it is very centrally located.",Date of stay: January 2018Traveler757736,Perfect,"We arrived in Colombo for our gap year - perfect place to stay first night. Lovey staff, especially Achila who looked after us very well and was happy to help with any questions. Very comfortable pods and good working showers / WiFi. Close to a great local bar where we danced with the locals to a live band. Overall fantastic start !",Date of stay: January 2018Kelly T,Great for a short stay!,"After a long flight UK to Dubai to Dubai to Colombo, the Star Anise Boutique Capsule Hotel provided a comfortable and friendly stay!  The first thing to consider when booking this hotel is the fact that it is a Capsule Hotel and not exactly a place that promotes privacy. We knew this when we booked, so we were more than happy with the double width, bunk bed arrangement with zippy ""door"" for privacy. My bestie (another female) and I shared a bed - or more specifically a capsule - for the night.  Plugs were provided in each capsule so we could charge our phones easily. The capsules have under bed storage, not big enough for our backpacks so we did have to leave them outside of the bed and trusted the other fellow travellers wouldn't wonder off with them. Course they didn't - I",Date of stay: September 2017Marei,Exceptionally clean!,"We slept in a capsule in a 10-bed-dorm and it was lovely! The capsules are very cosy, well equipped (spacious locker, light, usb-plugs...) and offer enough privacy. Staff are extremely friendly, breakfast is delicious and everything is exceptionally clean! We will book it again when we stay in Colombo for our return flight!",Date of stay: January 2018milosztom,would never stay there again,"We felt we have been cheated in this hostel. We came with booking that included breakfast. When we asked for it's time it turned out  we will have to leave before it starts. We asked for a take-away one (got it every time in Sri-Lanka we need to leave earlier) and guy serving us said, it should be possible but he need to ask manager first. He insisited we pay now and he will tell us later. When we paid, it turned out that the manager was seating all that time just next to him and when he asked manager simply said tak-away breakfast is impossible. What was the worst experience in this story was he tried to make idiot out of us and tell us that every booking has a breakfast included, which simply wasn't true. They also made problems with payment by card. It was our last day in Sri",sinfat,Perfect for short stay,"I checked in the hostel at 2:00pm and that was completely safe and smooth. The capsules had curtain to ensure absolute privacy. It was total different from bunk bed that any movement of the neighborhood would not affect you. The bed equipped with 2 usb charging pt and lighting. A large locker was under the bed. Breakfast was delicious. The location was extremely convenient, a few minutes walk to the train station.  Cons: Only 2 toilets was shared among everyone that I had to wait. Power blackout happened a few times but it was quite common in Sri Lanka.",Date of stay: December 2017288elisa,Perfect place to stay in Colombo,The people there are very friendly so you can ask them anything and they will try to help you as much as they can. They even showed us around in Colombo a little and gave us many recomendaciones for our trip in Sri Lanka. The location is pretty good and you can easily reach the train station by tuk-tuk or walking.,Ash D,Central location,"Stayed here for a couple of nights while passing through Colombo. The Star Anise is well located near the Fort shopping area of Colombo & close to the train station. The capsules and rooms are clean, as are the reception and kitchen areas. The capsules are equipped with lights, outlet/ charging area & luggage storage area. The shared bathrooms are very small - toilet/shower combined - and, while clean early in the morning, quickly got messy & wet throughout the day. There was a nice toilet next to the kitchen area but did not have a shower.",Date of stay: December 2017Nanda A,,,sjoerd v,Terrible night,"I came to this hotel for a good sleepingnight after my 11 hour train journey. The location is really good, next to old dutch hospital and 10 minute walk from Fort trainstation. But there where works under the hotel until 12 o'clock at night. Also the lights and airco turned automaticaly off after 10 minutes, I was in my bedcapsule reading a book before sleeping... The toilets and shower in one cabine is not that convenient.",Date of stay: November 2017berlines_errante,Short visit to explore Colombo,It is a very clean and comfortable hostel with a cool roof terrace. Good central location to explore Colombo in few hours. Close to Train and bus stations. The staff was very friendly and helpful. The only thing that I didn't like was that they scanned my passport and apparently sent the copy to the central office in Singapure...,Date of stay: November 2017manmeet_singh81,Clean Facilities & Good Breakfast,"Beds, bathrooms and overall area was exceptionally clean for a capsule hotel. Breakfast was good and enough for the little amount paid. Conveniently close to the train station and other amenities - we had dinner at Galle Face beach side within walking distance.  Would honestly recommend this place to travellers who are looking for cheap accommodation @ ""4/5-star"" service.",Date of stay: November 2017Thomasbakker,Nice place in Colombo,This Nice place in Colombo is a funny mix between a dorm and a private room. Location is good and close to train and busstation. They have dormlike rooms with single beds and with double beds. Staff is friendly and rooms and bathroomfacillitys are clean. Would recommend this to travellers who like to meet people.,Date of stay: November 2017522hannah,Great low budget acoomodation,"For a low budget accomodation it was great! Very clean, nice rooftop, super friendly staff and a nice little breakfast. The train station is in walking distance which was good for me as well. So I can really recommend.",flunflins,Good location,The hotel is located on the center of Colombo separate by walking distance from the train station Colombo Fort and bus station. The bathrooms as well as the rooms and rest of facilities are very clean and the stuff is very friendly. Good place to stay.,Date of stay: October 2017