user,review_title,review,dateMacoona,Clean and cozy for a dorm,"Very good place to stay for a night after arriving at Colombo and want to take the train or the bus the next morning. Both stations are very close to the hotel, in walking distance. The rooftop terrace could be more cozy, with nice light or sitting places.",Date of stay: February 2017Connector584107,Good & bad,"Double capsules decent size,new & clean. Annoying that the staff is passing by the capsules day & night as the laundry is just next to it. Very difficult to get some sleep as they are cleaning all day. Not bad located though.",Date of stay: February 2017Jessie E,Great Budget Stay in Colombo!,"This place just opened, and they are really focused on making sure guests have the best possible service during their stay. I've stayed twice now, two different times passing through Colombo. The first time, in December, I was with my boyfriend and a friend, and we had booked one double and one single premium capsule. Because the hotel wasn't fully booked that night, they actually put my friend in the double capsule area with us so we could all be in the same area! They were really helpful with information about trains and bus information, and scheduling a car for my friend to head to the airport.   After the good first experience, when my boyfriend and I came back through Colombo at the end of our Sri Lanka trip in January, we booked another night in a double capsule. When we",Date of stay: January 2017Ymniza,Best place for short rest,"Star Anise settle in the heart of Colombo, just two hundrede metres from Dutch Hospital. Star Anise very clean and quiet place. Dorm has four double beds with certains, privite socket and usb-charger. Bathroom and toilet are unisex.",Date of stay: January 2017missslbell,Great just landed option,"Clean, tidy, lots of zen, these capsule really work well   Excellent location and really easy to find   Everything was really new and the staff couldn´t have been more helpful    Nice touch was the running water feature",Date of stay: December 2016Kateřina J,,,Bjørn B,,,sccoc1,"Awesome hostel, comfiest beds with doona","By far the best beds in Sri Lanka which of course led to the best sleep. The capsules are amazing equiped with lights, coat hangers, power plugs and the comfiest bed in Sri Lanka. The hostel is extremely clean and well constructed and when the lay complete there terrace BBQ area this will be a fantastic place. We only stayed the one night at the end of our trip but our 4am flight meant we had to leave at 1am the following night. We didn't want to waste the money on another booking so we asked if we could leave our bags till 12:30 that night after we had checked out. Not only did they let us, but they allowed us to hang out in the common area and organised our transport. The place is top notch and the breakfast organised promptly and it was tasty. They are a new hostel but don't",Date of stay: December 2016Teresa C,Excellent !!!,"I cant describe that place. Everything is excellent. The staff, the bed, the breakfast, the owner who is always there.  It's a new hostel, but everything is working good.  One of the best hotels i've ever been.",Date of stay: December 2016zamir89,Great hostel with very nice bed and breakfast,Very nice people. Always smile and helpful. Service is really good! Nice capsules. Location is 4/5. Very good breakfast. Has everything you need. They provide clean towels and clean sheets. Very good bed. The best part was the service. 10/10. Love this place. Would come to stay again.,DuffstarBrewery,"Clean, clean, clean","Without doubt, this is the cleanest and most comfortable hotel/hostel we have stayed in the whole of Sri Lanka, quiet possibly even the world....  With less than 1km from Colombo Fort railway, it's an easy walk with backpacks. So you can even avoid the added expense of a Tuk-tuk ride if you want.  Our double bed capsule had the most comfortable mattress, 6 pillows, a cozy duvet and a great breakfast included.  Super fast WiFi, an abundance of WC's, security door, location, great staff, privacy.  I could go on and on about how good this place is.   We have already arranged to return next week.  *p.s. the noisy water feature in the sleeping area might drive you crazy at first, but once you tune in, it masks all of the bumps, knocks, bag rustlers and snorers that would normally",Date of stay: December 2016